{
  "description": "The attributes that identify network proxy attributes.",
  "meta": "profile",
  "caption": "Network Proxy",
  "name": "network_proxy",
  "annotations": {
    "group": "primary"
  },
  "attributes": {
    "proxy_connection_info": {
      "description": "The connection information from the network proxy to the remote server.",
      "requirement": "recommended"
    },
    "proxy_http_request": {
      "description": "The HTTP Request Object documents attributes of a request made from the network proxy to the remote server.",
      "requirement": "optional"
    },
    "proxy_http_response": {
      "description": "The HTTP Response from the remote server to the network proxy.",
      "requirement": "optional"
    },
    "proxy_traffic": {
      "description": "The network traffic refers to the amount of data moving across a network, from proxy to remote server at a given point of time. Intended to be used alongside Network Connection.",
      "requirement": "recommended"
    },
    "proxy_tls": {
      "description": "The Transport Layer Security (TLS) attributes from the network proxy to the remote server.",
      "requirement": "recommended"
    }
  }
}