{
  "description": "The domain reputation information.",
  "meta": "profile",
  "caption": "Domain Reputation",
  "name": "reputation",
  "attributes": {
    "categories": {
      "description": "A list of URL categories as defined by the event source.",
      "requirement": "recommended"
    },
    "category_ids": {
      "requirement": "recommended"
    },
    "domain_info": {
      "requirement": "recommended"
    },
    "parent_categories": {
      "requirement": "recommended"
    },
    "provider": {
      "description": "The provider of the reputation and category information.",
      "requirement": "recommended"
    }
  }
}