{
  "description": "The domain reputation information.",
  "meta": "profile",
  "caption": "Domain Reputation",
  "name": "domain_reputation",
  "attributes": {
    "domain_info": {
      "requirement": "recommended"
    },
    "provider": {
      "description": "The domain reputation provider information.",
      "requirement": "recommended"
    },
    "reputation": {
      "description": "The domain reputation.",
      "requirement": "optional"
    }
  }
}