{
  "description": "The additonal attributes that describe a person or user beyond those required for a user. These are expected to be used primarily to add additional context for the <code>user_inventory</code> event class.",
  "meta": "profile",
  "caption": "Person",
  "name": "person",
  "annotations": {
    "group": "primary"
  },
  "attributes": {
    "cost_center": {
      "requirement": "optional"
    },
    "created_time": {
      "description": "The timestamp when the user was created.",
      "requirement": "optional"
    },
    "deleted_time": {
      "requirement": "optional"
    },
    "employee_uid": {
      "requirement": "optional"
    },
    "given_name": {
      "requirement": "optional"
    },
    "hire_datetime": {
      "requirement": "optional"
    },
    "job_title": {
      "requirement": "optional"
    },
    "labels": {
      "description": "The labels associated with the user. For example in AD this could be the <code>userType</code>, <code>employeeType</code>. For example: <code>Member, Employee</code>",  
      "requirement": "optional"
    },
    "last_login_time": {
      "requirement": "optional"
    },
    "leave_datetime": {
      "requirement": "optional"
    },
    "location": {
      "description": "The detailed geographical location associated with a user. When used with the <code>user_inventory</code> event class, this typically documents the users usual work location.",
      "requirement": "optional"
    },
    "manager": {
      "requirement": "optional"
    },
    "modified_time": {
      "description":"The timestamp when the user entry was last modified",
      "requirement": "optional"
    },
    "office_location": {
      "requirement": "optional"
    },
    "email_addresses": {
      "caption": "Email Addresses",
      "group": "context",
      "requirement": "optional"
    },
    "surname": {
      "requirement": "optional"
    }
  }
}