{
  "description": "The file attributes that are associated with security software.",
  "meta": "profile",
  "caption": "File Security",
  "name": "file_security",
  "attributes": {
    "confidentiality": {
      "requirement": "optional"
    },
    "confidentiality_id": {
      "requirement": "optional"
    },
    "fingerprints": {
      "requirement": "recommended"
    },
    "signature": {
      "requirement": "optional"
    }
  }
}
