{
  "description": "The domain registrar information.",
  "meta": "profile",
  "caption": "Domain",
  "name": "domain_info",
  "attributes": {
    "confidentiality": {
      "requirement": "optional"
    },
    "confidentiality_id": {
      "requirement": "optional"
    },
    "fingerprints": {
      "requirement": "recommended"
    },
    "signature": {
      "requirement": "optional"
    },
    "md5": {
      "requirement": "recommended"
    },
    "sha1": {
      "requirement": "recommended"
    },
    "sha2": {
      "requirement": "recommended"
    }
  }
}